title, time, description, link 
b'United States API Weekly Crude Oil Stock: -3.608M (April 9) vs previous -2.618M', b'18 hours ago', b'United States API Weekly Crude Oil Stock: -3.608M (April 9) vs previous -2.618M. NEWS | 4/13/2021 8:47:19 PM GMT | By FXStreet Team', b'https://www.fxstreet.com/news/united-states-api-weekly-crude-oil-stock-3608m-april-9-vs-previous-2618m-202104132047' 
b'API shows crude distillate stocks down gasoline up -sources', b'18 hours ago', b'Industry group API did not respond to a request for comment. Crude stocks were down by 3.6 million barrels in the week ended April 9. Gasoline inventories rose...', b'https://www.nasdaq.com/articles/api-shows-crude-distillate-stocks-down-gasoline-up-sources-2021-04-13' 
b'WTI stays firmer above $60.00 following higher draw in API inventories', b'17 hours ago', b'API weekly crude oil stock for the period expired on April 09 marked a higher than -2.618M previous draw to -3.608M on Tuesday. The energy benchmark...WTI stays firmer above $60.00 following higher draw in API inventoriesSkip to main content| FXStreet Blog | GET THE APP| \xc2\xa0 \xc2\xa0NewsletterHomeRATES & CHARTSTOOLSLive ChartTrading PositionsForecast PollRates TableTechnical LevelsTechnical Confluences DetectorASSETSEUR/USDGBP/USDUSD/JPYAUD/USDNZD/USDUSD/CADGBP/JPYEUR/JPYDollar IndexGoldOilSP500NewsLATEST FOREX NEWSLatest NewsInstitutional ResearchLATEST NEWS BY ASSETSEUR/USDGBP/USDUSD/JPYAUD/USDNZD/USDUSD/CADUSD/CHFEUR/GBPDollar IndexCommoditiesBondsEquitiesAnalysisSECTIONSLatest AnalysisEDITORIAL SELECTIONEUR/USDGBP/USDUSD/JPYAUD/USDUSD/CADDollar IndexOilGoldStocksCommoditiesBondsRisk On/OffSupport and ResistanceElliott WaveCyclesSentimentEconomic CalendarTOOLSEconomic CalendarInterest RatesMarket HoursTOP EVENTSCoronavirusBrexitNonfarm PayrollsFedBoCECBBoEBoJRBARBNZSNBCryptosSECTIONSLatest NewsRates & ChartsEducationSECTIONSBitcoinEthereumRippleLitecoinBitcoin CashVideoSECTIONSLatest Live VideosShows ScheduleBecome PremiumMOST POPULAR COACHESEd PonsiGiuseppe BasileSarid HarperAlex OngSam SeidenSteve RuffleyRob ColvilleNenad KerkezGon\xc3\xa7alo MoreiraNavin PrithyaniDavid PeglerWalter PetersEducationBrokersSECTIONSForex BrokersBroker NewsBroker SpreadsSignals;WTI ticks up on upbeat industry stockpile data.Weaker US dollar and OPEC demand forecast join geopolitical worries from Iran to favor the energy buyers.EIA inventories US dollar moves will be the key to watch.Having flashed the strongest gains in two weeks WTI remains positive around $60.50 amid the initial Asian session trading on Wednesday. In doing so the energy benchmark respects a higher than the previous draw in weekly stockpile data from the American Petroleum Institute (API) as well as the US dollar weakness. Also supporting the black gold could be the geopolitical worries emanating from Iran.API weekly crude oil stock for the period expired on April 09 marked a higher than -2.618M previous draw to -3.608M on Tuesday. The energy benchmark benefited from the stock as the supply crunch is likely to be met with a higher demand amid economic recovery.The\xc2\xa0Organization of the Petroleum Exporting Countries (OPEC) raised its forecast for global oil demand growth in 2021 to 5.95 million barrels per day (bpd) from 5.89 million (bpd) in the previous report per Reuters.Elsewhere the US dollar index (DXY) dropped to the fresh three-week low following upbeat US inflation figures and strong bond auction not to forget the fresh coronavirus (COVID-19) vaccine fears after blood clotting issues with the Johnson & Johnson jabs.It should be noted that fears of a 60% increase in Uranium enrichment by Iran and the following global repercussions are also providing background support to the black gold.Moving on the weekly official inventory data from the Energy Information Administration (EIA) expected -2.154M versus -3.522M prior will be crucial but major attention will be given to the risk catalysts and the US dollar moves for fresh impulse.Technical analysisA clear break above a downward sloping trend line from March 08 around $60.35-40 becomes necessary for oil bulls to stay hopeful.Additional important levelsOverviewToday last price60.49Today Daily Change0.83Today Daily Change %1.39%Today daily open59.66TrendsDaily SMA2060.68Daily SMA5060.62Daily SMA10054.75Daily SMA20047.69LevelsPrevious Daily High60.79Previous Daily Low58.77Previous Weekly High61.41Previous Weekly Low57.66Previous Monthly High67.87Previous Monthly Low57.27Daily Fibonacci 38.2%60.02Daily Fibonacci 61.8%59.54Daily Pivot Point S158.69Daily Pivot Point S257.72Daily Pivot Point S356.67Daily Pivot Point R160.71Daily Pivot Point R261.76Daily Pivot Point R362.73Feed newsGet Weekly Crypto trade ideas! \xc2\xa0 Empower yourself with the best market insightsJoin FXStreet Premium!Latest Forex NewsLatest Forex NewsEditors\xe2\x80\x99 PicksEUR/USD extends gains above 1.1950 ahead of Lagarde PowellEUR/USD is trading above 1.1950 extending its gains and trading at three-week highs. Markets cheer tame US inflation and await speeches by the ECB\'s Lagarde and the Fed\'s Powell. Vaccine developments are eyed.EUR/USD NewsGBP/USD nears 1.38 as US Treasury yields fallGBP/USD is hovering near 1.38 as the US dollar remains under pressure alongside US Treasury yields. Britain\'s successful vaccination campaign is boosting sterling. The BOE\'s Haskel and the Fed\'s Powell are set to speak.GBP/USD NewsDogecoin targets $0.245 after new wave of celebrity endorsementsDogecoin receives fresh support from Mark Cuban and Guy Fieri. Dogecoin price surges 70% in less than 48 hours hitting the middle line of an ascending parallel channel. A continuation of this bullish momentum could push DOGE up by 118% toward $0.245.Read moreXAU/USD remains confined in a range above 100-hour SMAGold struggled for a firm direction and remained confined in a range on Wednesday. The subdued price action constitutes the formation of a rectangle on the 1-hour chart. A mixed technical set-up warrants some caution before placing fresh directional bets.Gold NewsWhen can I buy NASDAQ:COIN?Coinbase IPO (direct listing) set for Wednesday April 14. Bitcoin marks perfect timing with a new record high. Coinbase Nasdaq:COIN is going public via a direct listing a $250 reference price.Read moreForex MAJORSCryptocurrenciesSignatures\xc2\xa92021 "FXStreet" All Rights ReservedAbout UsAbout UsEditorial GuidelinesEthical CodeCorporate IdentityFXStreet Blog Site Map Terms and conditions Contact us Advertising JobsLanguagesEditionEspa\xc3\xb1olItalianoBahasa IndonesiaPortugu\xc3\xaas\xe6\x97\xa5\xe6\x9c\xac\xe8\xaa\x9e\xe7\xb9\x81\xe9\xab\x94\xe4\xb8\xad\xe6\x96\x87\xe7\xae\x80\xe4\xbd\x93\xe4\xb8\xad\xe6\x96\x87\xd0\xa0\xd1\x83\xd1\x81\xd1\x81\xd0\xba\xd0\xb8\xd0\xb9Fran\xc3\xa7ais\xd8\xa7\xd9\x84\xd8\xb9\xd8\xb1\xd8\xa8\xd9\x8a\xd8\xa9DeutschMagyarT\xc3\xbcrk\xc3\xa7eTi\xe1\xba\xbfng Vi\xe1\xbb\x87tDisclaimerNote: All information on this page is subject to change. The use of this website constitutes acceptance of our user agreement. Please read our privacy policy and legal disclaimer.Trading foreign exchange on margin carries a high level of risk and may not be suitable for all investors. The high degree of leverage can work against you as well as for you. Before deciding to trade foreign exchange you should carefully consider your investment objectives level of experience and risk appetite. The possibility exists that you could sustain a loss of some or all of your initial investment and therefore you should not invest money that you cannot afford to lose. You should be aware of all the risks associated with foreign exchange trading and seek advice from an independent financial advisor if you have any doubts.Opinions expressed at FXStreet are those of the individual authors and do not necessarily represent the opinion of FXStreet or its management. FXStreet has not verified the accuracy or basis-in-fact of any claim or statement made by any independent author: errors and Omissions may occur.Any opinions news research analyses prices or other information contained on this website by FXStreet its employees partners or contributors is provided as general market commentary and does not constitute investment advice. FXStreet will not accept liability for any loss or damage including without limitation to any loss of profit which may arise directly or indirectly from use of or reliance on such information.', b'https://www.fxstreet.com/news/wti-stays-firmer-above-6000-following-higher-draw-in-api-inventories-202104132149' 
b'Stocks Set To Open Higher As Big Banks Report Strong Earnings ...', b'2 hours ago', b"Interestingly shares of Goldman Sachs and Wells Fargo are gaining some ground in ... It should be noted that the recent API Crude Oil Stock Change report...Stocks Set To Open Higher As Big Banks Report Strong Earnings ResultsFXEMPIREAllAdEnglishEnglishItalianoDanskDutchFran\xc3\xa7aisDeutschE\xce\xbb\xce\xbb\xce\xb7\xce\xbd\xce\xb9\xce\xba\xce\xac\xd8\xa7\xd9\x84\xd8\xb9\xd8\xb1\xd8\xa8\xd9\x8a\xd8\xa9NorskPortugu\xc3\xaas\xd0\xa0\xd1\x83\xd1\x81\xd1\x81\xd0\xba\xd0\xb8\xd0\xb9Espa\xc3\xb1olSvenskaT\xc3\xbcrk\xc3\xa7e\xe6\x97\xa5\xe6\x9c\xac\xe8\xaa\x9eMarketsCryptoNewsForecastsEducationFXTM AcademyTrade NowBrokersToolsEconomic CalendarMacro DataCurrenciesCommoditiesIndicesStocksStock ExchangesCrypto HubExchangesWalletsEconomic NewsForex NewsCryptocurrencies NewsCommodities NewsOpinionsBrokers NewsCommoditiesCurrenciesIndicesCryptocurrenciesExpand Your KnowledgeBasic EducationAdvanced EducationLive WebinarsFinancial GlossaryForex Brokers FilterForex Brokers Comparison ToolForex Brokers PromotionsBest Forex BrokersForex Brokers With Best PlatformsRegulated Forex BrokersBest UK Forex BrokersBest US Forex BrokersBest Australian BrokersBest Forex Brokers For BeginnersOnline Stock Brokers FilterTrading toolsStock ExchangesCurrency ConverterStock ScreenerMacro HubSovereign Credit RatingsInterest RatesGlobal Major IndicatorsNews StreamAdvertisementAdvertisementhomenewsStocks Set To Open Higher As Big Banks Report Strong Earnings ResultsMeanwhile WTI oil is trying to settle above the $61 level as Iran moves to enrich uranium up to 60% purity.Vladimir Zernov17 minutes ago (Apr 14 2021 12:45 PM GMT)Add to BookmarksTreasury Yields Stay Close To Recent LowsS&P 500 futures are gaining some ground in premarket trading as Treasury yields remain close to recent lows. Yesterday U.S. inflation reports indicated that inflation was rising a bit faster than analysts expected.However this increase is not sufficient enough to trigger any response from the Fed so Treasury yields declined after the release of inflation reports. Today Treasury yields remain close to yesterday\xe2\x80\x99s levels which is bullish for tech stocks which look ready to continue their upside move.AdvertisementBig Banks Report EarningsJPMorgan has recently released its quarterly results. The company reported revenue of $32.3 billion and earnings of $4.50 per share beating analyst estimates on both earnings and revenue. Goldman Sachs and Wells Fargo reports also exceeded analyst estimates.Financial stocks had a strong start of the year as yields moved higher and it looks that investors have made a right move by betting on the financial segment as results look strong.Interestingly shares of Goldman Sachs and Wells Fargo are gaining some ground in premarket trading while JPMoran stock is down by about 0.5% but the situation may change quickly when the regular trading session begins.Oil Moves Higher As Iran Tensions IncreaseWTI oil is currently trying to settle above the $61 level as the fate of renewed nuclear talks with Iran is under question. Recently participants of the 2015 nuclear deal made an attempt to put Iran and U.S. back to the negotiation table but the recent attack on Iran\xe2\x80\x99s Natanz nuclear facility increased tensions.In response to the attack Iran stated that it would enrich uranium up to 60% purity. It is not clear whether Iran has the technical capability to do so in the near term but the move clearly raises stakes in the complicated game between U.S. Iran and other participants of the 2015 nuclear deal.It should be noted that the recent API Crude Oil Stock Change report indicated that crude inventories decreased by 3.6 million barrels and provided additional support to the oil market. If today\xe2\x80\x99s EIA Weekly Petroleum Status Reports confirms API numbers oil may gain additional upside momentum.For a look at all of today\xe2\x80\x99s economic events check out our economic calendar.Don't miss a thing!Discover what's moving the markets. Sign up for a daily update delivered to your inboxEmailSign upLatest ArticlesSee AllExpand Your KnowledgeSee AllWhat is Dogecoin?What are NFTs? Evrything you Need to Know About Non-Fungible TokensThe Rise of Defi: Powering the Next Crypto BoomMost PopularAn Anticipated Fall in Eurozone Industrial Production Weighs on the EUREuropean Equities: Economic Data ECB President Lagarde and Corporate Earnings in FocusExplainer: What is a Global Minimum Tax and How Could it Affect Companies Countries?EUR/USD Mid-Session Technical Analysis for April 14 2021Australian Dollar On The RiseLoadingLoadingSponsoredSponsoredThis Section / Page contains links to the 3rd party websites of our top partners from whom we may receive compensation.Trade With A Regulated BrokerABOUT USPRIVACY POLICYTERMS OF USECONTACT USCOOKIE SETTINGSADVERTISE WITH USBECOME A CONTRIBUTORGET FINANCIAL CONTENTWEBSITE WIDGETSFXEMPIRE'S ARCHIVED POSTSFOLLOW USSUBSCRIBE TO NOTIFICATIONSIMPORTANT DISCLAIMERSRISK DISCLAIMERS", b'https://www.fxempire.com/news/article/stocks-set-to-open-higher-as-big-banks-report-strong-earnings-results-720050' 
