title, time, description, link 
b'Bed Bath & Beyond shares fall on mixed results backs forecast as turnaround continues', b'4 hours ago', b'Bed Bath & Beyond reported a double-digit decline in fiscal fourth-quarter sales as ongoing store closures and divestments weigh on results. The retailer...Bed Bath & Beyond (BBBY) Q4 2020 earningsSkip NavigationMarketsPre-MarketsU.S. MarketsEurope MarketsChina MarketsAsia MarketsWorld MarketsCurrenciesCryptocurrencyFutures & CommoditiesBondsFunds & ETFsBusinessEconomyFinanceHealth & ScienceMediaReal EstateEnergyEnvironmentTransportationIndustrialsRetailWealthLifeSmall BusinessInvestingInvest In YouPersonal FinanceFintechFinancial AdvisorsTrading NationOptions ActionETF StreetBuffett ArchiveEarningsTrader TalkTechCybersecurityEnterpriseInternetMediaMobileSocial MediaVenture CapitalTech GuidePoliticsWhite HousePolicyDefenseCongressFinding SolutionsEurope PoliticsChina PoliticsAsia PoliticsWorld PoliticsCNBC TVLive AudioLatest VideoTop VideoCEO InterviewsEurope TVAsia TVCNBC PodcastsDigital OriginalsWatchlistPROPro NewsPro LiveSubscribeSign InMenuKey PointsBed Bath & Beyond reported a double-digit decline in fiscal fourth-quarter sales as ongoing store closures and divestments weigh on results.The retailer reaffirmed its outlook for fiscal 2021 revenue of between $8 billion and $8.2 billion.It\'s in the process of remodeling stores and launching a number of private brands betting these efforts will drive shoppers and sales in the coming years.In this articleBBBYSource: Bed Bath & BeyondBed Bath & Beyond on Wednesday reported a double-digit decline in fiscal fourth-quarter sales as ongoing store closures and divestments that are part of a bigger turnaround plan continue to weigh on results.Its shares fell more than 8% in premarket trading as some investors expected to find clearer signs of progress."There are some positive things but it\'s still moving" said Jessica Ramirez a retail research analyst for Jane Hali & Associates. "Knowing the Street they want these turnarounds quite quickly. By this time investors want things to be a bit in better shape."The big-box retailer reaffirmed a prior sales outlook for the coming fiscal year noting that positive sales momentum has carried into the current quarter. Many Americans have turned to the company\'s stores and website during the Covid pandemic to buy cleaning supplies kitchen appliances bedding and other items for their homes.Results in its first quarter however are going to be messy Chief Executive Mark Tritton explained in an interview. In the year-ago period all of Bed Bath & Beyond\'s stores were shut due to the health crisis and it was totally reliant on its digital business to fuel sales. That\'s unlike some retailers notably Walmart and Target that have been able to keep their stores open throughout the pandemic."What you see is some number turbulence" Tritton said. "You\'re going to see a bifurcation in the retail market."Here\'s how the company did during the quarter ended Feb. 27 compared with what analysts were anticipating using a survey by Refinitiv:Earnings per share: 40 cents adjusted vs. 31 cents expectedRevenue: $2.62 billion vs. $2.63 billion expectedBed Bath & Beyond\'s net income during the period grew to $9.1 million or 8 cents per share compared with a loss of $65.4 million or 53 cents per share a year earlier. Excluding one-time adjustments the company earned 40 cents per share better than the 31 cents expected by analysts polled by Refinitiv.Net sales fell about 16% to $2.62 billion from $3.11 billion a year earlier. That was slightly short of the $2.63 billion that analysts were anticipating.The company said the year-over-year decline was driven in part by the sale of its Christmas Tree Shops and Cost Plus World Market businesses as well as ongoing store closures.Same-store sales rose 4% the company said. Online sales surged 86% during the fourth quarter but that wasn\'t enough to totally offset reported double-digit declines of in-store traffic. The company noted that 41% of online sales were fulfilled by stores.Within the namesake Bed Bath & Beyond business it saw the most growth in home organization followed by kitchen food prep indoor decor and then bedding. Same-store sales at the Bed Bath & Beyond banner were up 6%.Bed Bath & Beyond reaffirmed its fiscal 2021 sales outlook that it gave back in January which calls for sales to be within a range of $8 billion and $8.2 billion. Analysts were estimating 2021 sales of $8.18 billion according to Refinitiv.The current quarter will be impacted by not only store closures in the year-ago period but also by the company\'s ongoing restructuring. Its four core banners are Bed Bath & Beyond Buybuy Baby Harmon Face Values and Decorist.The retailer is forecasting first-quarter net sales to increase by more than 40% year over year. Analysts had been calling for a 45.8% jump. Excluding the impact from divested businesses however Bed Bath & Beyond said sales from its four core banners could grow upwards of 65% to 70%.\'Early days\'Bed Bath & Beyond CEO Mark TrittonSource: Bed Bath & BeyondTritton played a crucial role in his previous gig as chief merchant at Target to help the big-box retailer build excitement with customers around exclusive brands and refurbished stores. Wall Street is still waiting to see if he can achieve the same success at Bed Bath & Beyond.As part of Tritton\'s turnaround plans Bed Bath & Beyond is in the process of remodeling roughly 130 to 150 stores this fiscal year including 26 remodels during the first quarter. It just completed its first batch in the Houston market in February.The company said it will spend about $250 million over the next three years to remodel roughly 450 Bed Bath & Beyond shops in total. That involves decluttering aisles and removing sky-high piles of merchandise often seen on top shelves adding fresh signage and installing more modern light fixtures."It\'s early days" Tritton told CNBC about the remodels. "Normally we have a period of adjustment as we go through every remodel ... it\'s about a 12-week process."Bed Bath & Beyond is also bolstering its roster of private labels across different categories of home goods. It\'s planning to launch at least eight brands this year hoping the exclusivity will be enough to drive people to its stores over the competition which includes Amazon.VIDEO4:5704:57Bed Bath & Beyond CEO on launch of eight new owned brands in 2021Squawk on the StreetLast month it debuted Nestwell which sells bed and bath items. Haven a spa-inspired bath brand will launch next week.Bed Bath & Beyond has said it expects its private-label sales will grow to represent 30% of its business within three years up from about 10% from today. The company said these efforts should also help boost its profitability.As the year progresses Bed Bath & Beyond said it expects sequential improvement in profit margins. Its hope is that pressures from heightened freight costs which have impacted many retailers over the course of the pandemic will ease."In 2020 our mix of digital to stores was outsized" Tritton said. "A digital sale because of the shipping costs is always a little different. We\'re going to see that recalibrate in 2021."This year the company plans to buy back $325 million of its own stock up from $300 million last year. Its three-year repurchase authorization was increased to $1 billion from $825 million.Bed Bath & Beyond shares are up about 57% year to date as of Tuesday\'s market close. The company has a market cap is $3.4 billion.Find the full earnings press release from Bed Bath & Beyond here.\xe2\x80\x94CNBC\'s Courtney Reagan contributed to this reporting.VIDEO3:3803:38Nike Urban Outfitters Abercrombie and Fitch set to be teen favorite brandsPower LunchSubscribe to CNBC PROLicensing & ReprintsCNBC CouncilsSupply Chain ValuesCNBC on PeacockAdvertise With UsJoin the CNBC PanelDigital ProductsNews ReleasesClosed CaptioningCorrectionsAbout CNBCInternshipsSite MapAd ChoicesCareersHelpContactNews TipsGot a confidential news tip? We want to hear from you.Get In TouchCNBC NewslettersSign up for free newsletters and get more CNBC delivered to your inboxSign Up NowGet this delivered to your inbox and more info about our products and services.\xc2\xa0Privacy Policy|Do Not Sell My Personal Information|CA Notice|Terms of Service\xc2\xa9 2021 CNBC LLC. All Rights Reserved. A Division of NBCUniversalData is a real-time snapshot *Data is delayed at least 15 minutes. Global Business and Financial News Stock Quotes and Market Data and Analysis.Market Data Terms of Use and DisclaimersData also provided by', b'https://www.cnbc.com/2021/04/14/bed-bath-beyond-bbby-q4-2020-earnings.html' 
b'Should You Sell Bed Bath & Beyond Inc. (BBBY) Stock Wednesday Morning?', b'2 hours ago', b"BBBY has a roughly average overall score of 34 meaning the stock holds a better value than 34% of stocks at its current price. InvestorsObserver's overall ranking...Should You Sell Bed Bath & Beyond Inc. (BBBY) Stock Wednesday Morning?News HomeShould You Sell Bed Bath & Beyond Inc. (BBBY) Stock Wednesday Morning?Wednesday April 14 2021 08:36 AM | InvestorsObserver AnalystsBed Bath & Beyond Inc. (BBBY) is down -9.42%% today.BBBY has an Overall Score of 34. Find out what this means to you and get the rest of the rankings on BBBY!See Full BBBY ReportBBBY stock closed at $27.93 and is down -$2.63 during pre-market trading. Pre-market tends to be more volatile due to significantly lower volume as most investors only trade between standard trading hours.BBBY has a roughly average overall score of 34 meaning the stock holds a better value than 34% of stocks at its current price. InvestorsObserver's overall ranking system is a comprehensive evaluation and considers both technical and fundamental factors when evaluating a stock. The overall score is a great starting point for investors that are beginning to evaluate a stock.BBBY gets a average Short-Term Technical score of 60 from InvestorsObserver's proprietary ranking system. This means that the stock's trading pattern over the last month have been neutral. Bed Bath & Beyond Inc. currently has the 65th highest Short-Term Technical score in the Specialty Retail industry. The Short-Term Technical score evaluates a stock's trading pattern over the past month and is most useful to short-term stock and option traders.Bed Bath & Beyond Inc.'s Overall and Short-Term Technical score paint a mixed picture for BBBY's recent trading patterns and forecasted price.Click Here to get the full Stock Score Report on Bed Bath & Beyond Inc. (BBBY) Stock.Share this article:Related ArticlesDo Traders Think Takung Art Co Ltd (TKAT) Can Turn Around Wednesday?Wednesday April 14 2021 10:16 AM | InvestorsObserver AnalystsIs Movado Group Inc (MOV) Stock Near the Top of the Luxury Goods Industry?Wednesday April 14 2021 08:40 AM | InvestorsObserver AnalystsIs Companhia Brasileira de Distribuicao (CBD) a Winner in the Department Stores Industry?Wednesday April 14 2021 08:40 AM | InvestorsObserver AnalystsIs Floor & Decor Holdings Inc (FND) The Right Choice in Home Improvement Retail?Wednesday April 14 2021 08:40 AM | InvestorsObserver AnalystsIs L Brands Inc (LB) the Top Pick in the Apparel Retail Industry?Wednesday April 14 2021 08:40 AM | InvestorsObserver AnalystsIs Lennar Corporation (LEN) The Right Choice in Residential Construction?Wednesday April 14 2021 08:40 AM | InvestorsObserver AnalystsRelated CompaniesBBBYYou May Also LikeRelated ArticlesDo Traders Think Takung Art Co Ltd (TKAT) Can Turn Around Wednesday?Wednesday April 14 2021 10:16 AM | InvestorsObserver AnalystsIs Movado Group Inc (MOV) Stock Near the Top of the Luxury Goods Industry?Wednesday April 14 2021 08:40 AM | InvestorsObserver AnalystsIs Companhia Brasileira de Distribuicao (CBD) a Winner in the Department Stores Industry?Wednesday April 14 2021 08:40 AM | InvestorsObserver AnalystsIs Floor & Decor Holdings Inc (FND) The Right Choice in Home Improvement Retail?Wednesday April 14 2021 08:40 AM | InvestorsObserver AnalystsIs L Brands Inc (LB) the Top Pick in the Apparel Retail Industry?Wednesday April 14 2021 08:40 AM | InvestorsObserver AnalystsIs Lennar Corporation (LEN) The Right Choice in Residential Construction?Wednesday April 14 2021 08:40 AM | InvestorsObserver AnalystsRelated CompaniesBBBYContact413-A East Main StreetCharlottesville VA 22902US: +1 800 698 9101International: +1 434 293 9100StocksStocks DashboardTop 5 StocksStock ScreenerOptionsOptions DashboardOptions PortfoliosOptions Trade ScreenerAccount and SupportMy AccountAbout UsNewslettersContact UsHelp CenterReviewsEmail Whitelist InstructionsStock Price data may be delayed up to 15 minutes.Copyright \xc2\xa9 2021. Portions of this content may be copyrighted by Fresh Brewed Media Investors Observer and/or O2 Media LLC. All Rights Reserved. Portions of this content protected by US Patent numbers 7865496 7856390 and 7716116. Investing in stocks bonds option and other financial instruments involve risks and may not be suitable for everyone. Portfolio results are unaudited and based on varying investment expiration dates. Terms of Service | Privacy Policy", b'https://www.investorsobserver.com/news/stock-update/should-you-sell-bed-bath-beyond-inc-bbby-stock-wednesday-morning' 
b'Bed Bath & Beyond Shipping E-Commerce Costs Hurt Profit', b'4 hours ago', b"Bed Bath & Beyond Inc.'s shares plunged after higher shipping and e-commerce costs eroded profitability in the fourth quarter tarnishing the results as the...Bloomberg - Are you a robot?We've detected unusual activity from your computer networkTo continue please click the box below to let us know you're not a robot.Why did this happen?Please make sure your browser supports JavaScript and cookies and that you are not blocking them from loading. For more information you can review our Terms of Service and Cookie Policy.Need Help?For inquiries related to this message please contact our support team and provide the reference ID below.Block reference ID:", b'https://www.bloomberg.com/news/articles/2021-04-14/bed-bath-beyond-posts-stronger-than-expected-quarterly-sales' 
