title, time, description, link 
b'Beyond Meat (BYND) stock forecast for 2021-2025: are we reaching a turning point?', b'1 day ago', b'BYND stock analysis. The chart below shows how the latest movement in Beyond Meat shares has resulted in a series of higher-highs while the price has found...', b'https://capital.com/beyond-meat-bynd-stock-forecast-2021-2025' 
b"It's Holding Steady for Now But Stay Away From Beyond Meat Stock", b'1 day ago', b"BYND Stock: There's Now a Stronger Bear Case. Despite its resiliency the bull case for Beyond stock has weakened over the past year. That's clear from the...BYND Stock: Beyond Meat Is Holding Steady for Now But Stay Away | InvestorPlaceSkip to contentClose MenuLog inLog outMy ServicesSupportPremium ServicesOur AnalystsContact UsHelpCareersAdvertise With UsDisclosures & DisclaimersPrivacy PolicyTerms of UseDMCA PolicyCopyright \xc2\xa9 2021 InvestorPlace Media LLC. All rights reserved. 1125 N. Charles St Baltimore MD 21201.Millions of People Will Soon Be Blindsided. Will You Be One of Them?On April 20 at 7 p.m. ET Louis Navellier and Matt McCall will reveal an event that\xe2\x80\x99s about to rock the stock market and how you could use it to beat the markets by nearly 11X.Tue April 20 at 7:00PM ETDaysHoursMinutesSecondsRegister Here FreeHome / Expert Stock Picks to Buy Now / Stocks to Sell / It\xe2\x80\x99s Holding Steady for Now But Stay Away From Beyond Meat StockAs you may know I\xe2\x80\x99ve long been a bear on Beyond Meat (NASDAQ:BYND) stock. Namely due to the risk that its plant-based \xe2\x80\x9cmeat\xe2\x80\x9d products are more a fad than a long-term trend. Sure there\xe2\x80\x99s a substantial market to cater to among vegetarians and vegans. But even that\xe2\x80\x99s not a big enough pool of a user base for this company to live up to investor expectations. Instead it needs mass adoption of plant-based \xe2\x80\x9cmeat\xe2\x80\x9d among omnivorous eaters.Source: Sundry Photography / Shutterstock.comThe problem? It\xe2\x80\x99s questionable whether this will even happen. Many have tried the product but there\xe2\x80\x99s little to suggest these first-time users have become repeat customers. Yet bulls so far have decided to ignore this concern.Not that enthusiasm for this stock has been off the charts. Shares rapidly rebounded from their coronavirus crash losses in March 2020. But in the second half of last year the stock zig-zagged between $125 and $195 per share.It\xe2\x80\x99s holding steady now. But don\xe2\x80\x99t expect it to continue to do so. Much less head back toward all-time highs above $200 per share. So what does the future hold for shares? As it continues to disappoint with its quarterly results substantial losses could be ahead. That gives you good reason to sell it if you own it and avoid it if you\xe2\x80\x99ve yet to enter a position.BYND Stock: There\xe2\x80\x99s Now a Stronger Bear CaseDespite its resiliency the bull case for Beyond stock has weakened over the past year. That\xe2\x80\x99s clear from the company\xe2\x80\x99s most recent quarterly earnings report. It missed on revenue with wider-than-expected losses. On a year-over-year basis growth was anemic (around 3.5%).Much of this has to do with the pandemic. Covid-19 lockdowns helped to dramatically boost demand for its customer-based business (Beyond Meat products sold in grocery stores). But the virus has been bad news for its food service sales. Sales to this segment could improve as the service economy recovers post-virus. Beyond has also locked down deals with two major fast food operators. But even the company itself admits the near-term impact from these deals will be modest at best.And this isn\xe2\x80\x99t the only problem on the company\xe2\x80\x99s plate. With the added hurdle of its main plant-based \xe2\x80\x9cmeat\xe2\x80\x9d rival slashing prices margin compression remains a big risk as well. So with all these issues plus the longstanding concern that synthetic meat is just a fad why do investors continue to give BYND stock a rich valuation?It\xe2\x80\x99s a question many long this stock have yet to ask themselves. But if they start doing so looking at this \xe2\x80\x9cstory stock\xe2\x80\x9d with a more critical eye shares may take a substantial plunge some time down the road.Richly Priced Beyond Has Lots of Room to FallAt 14.4x estimated 2021 sales BYND stock trades at a valuation on par with cannabis or electric vehicle (EV) stocks. But unlike those types of plays backed by long-term trends such as pot legalization or vehicle electrification this plant-based \xe2\x80\x9cmeat\xe2\x80\x9d company doesn\xe2\x80\x99t have such a \xe2\x80\x9cmegatrend\xe2\x80\x9d on its side.Sure there\xe2\x80\x99s been a big push in recent years for plant-based health. Not just for health reasons but for environmental reasons as well. This trend has picked up steam in recent years. But as seen from its slowing sales growth there\xe2\x80\x99s more evidence things are decelerating rather than accelerating.In short there\xe2\x80\x99s little justification for the stock\xe2\x80\x99s current growth premium. So what\xe2\x80\x99s a more reasonable valuation for Beyond Meat shares? That depends on its eventual profitability. For now investors are not valuing this company on its current year results. Or even its results in 2022 when it\xe2\x80\x99s expected to generate earnings of 22 cents per share.Instead its current market capitalization (around $8.2 billion) is built on its potential value down the road when it fully scales up and lets its foot off the gas. However given the specter of margin compression it\xe2\x80\x99s hard to tell whether this company at scale can even become a high-margin business.There\xe2\x80\x99s not much rationale giving this stock a valuation premium to other packaged/processed foods companies most of which trade for single-digit price-to-sales multiples. In other words big downside ahead if Beyond continues to disappoint.Ahead of a Possible Blow Up Sell into StrengthLast Month Barron\xe2\x80\x99s listed Beyond Meat as one of ten stocks most vulnerable to a blow up. And given what I discussed above it\xe2\x80\x99s easy to see why. Priced like a megatrend stock when in reality its business is built on a passing fad valuation contraction remains a big risk.For now those still confident in its prospects may ignore the warning signs. But as we see subsequent underwhelming results something has to give. So what\xe2\x80\x99s the best move with BYND stock? Sell into strength (while you still can).On the date of publication neither Matt McCall nor the InvestorPlace Research Staff member primarily responsible for this article held (either directly or indirectly) any positions in the securities mentioned in the article.Matthew McCall left Wall Street to\xe2\x80\xafactually help\xc2\xa0investors \xe2\x80\x94 by getting them into the world\xe2\x80\x99s biggest most revolutionary trends BEFORE anyone else.\xc2\xa0Click here to see what Matt has up his sleeve now.Matt McCallEditor MoneyWireMeet Matt McCallWith his next-generation approach to investing Matt McCall finds better stocks for you to invest in \xe2\x80\x94 not the same old companies over-hyped on Wall Street.Learn more about MattArticle printed from InvestorPlace Media https://investorplace.com/moneywire/2021/04/bynd-stock-holding-steady-now-but-stay-away/.\xc2\xa92021 InvestorPlace Media LLCMore from Matt McCallMarket Insight Financial ArticlesDon\xe2\x80\x99t Miss My Favorite Semiconductor StocksBy Matt McCallApr 13 2021UncategorizedThe Chip Stocks You Should Be Keeping an Eye OnBy Matt McCallApr 13 2021Stocks to SellDespite the Rally in Exxon Mobil Stock Continue to Avoid ItBy Matt McCall and the InvestorPlace Research StaffApr 12 2021ADVERTISEMENTMatt's Most PopularHot StocksDon\xe2\x80\x99t Miss This Chance for Life-Changing Profits With Small High-Growth StocksHot StocksEvery Investor Should Own at Least Some of These StocksHot StocksWhat Square\xe2\x80\x99s $50 Million Bitcoin Investment Means for YouHot StocksThis Bill Gates-Backed Company Is Making Big Waves in the Battery WorldHot Stocks5G Stocks: This New Era of Massive Profits Just BeganContact UsHelpCareersAdvertise With UsDisclosures & DisclaimersPrivacy PolicyTerms of UseDMCA PolicyFinancial Market Data powered by FinancialContent Services Inc. All rights reserved. Nasdaqquotes delayed at least 15 minutes all others at least 20 minutes.Copyright \xc2\xa92021 InvestorPlace Media LLC. All rights reserved. 1125 N. Charles St Baltimore MD 21201.Subscriber Sign inUsernamePasswordSign inHaving trouble logging in?Not Yet a Premium Subscriber?SubscribeClose login modal", b'https://investorplace.com/moneywire/2021/04/bynd-stock-holding-steady-now-but-stay-away/' 
b'Beyond Meat gains after announcing major European retail expansion', b'2 days ago', b'Related Stocks. Symbol Last Price % Chg. BYNDBeyond Meat Inc...', b'https://seekingalpha.com/news/3680921-beyond-meat-gains-after-announcing-major-european-retail-expansion' 
b'Beyond Meat (BYND) Expands Retail Product Distribution in Europe', b'17 hours ago', b'5 Stocks Set to Double. Each was hand-picked by a Zacks expert as the #1 favorite stock to gain +100% or more in 2020. Each comes from...', b'https://www.nasdaq.com/articles/beyond-meat-bynd-expands-retail-product-distribution-in-europe-2021-04-13' 
