title, time, description, link 
b'Second Sight Medical Products (EYES) Stock Shows Early Sign Of ...', b'2 days ago', b'After having suffered from a significant decline the Second Sight Medical Products (NASDAQ: EYES) stock has gone into recovery mode. This could well be the...Second Sight Medical Products (EYES) Stock Shows Early Sign Of Rebound \xe2\x80\x93 Own SnapSkip to contentHealthcareApril 12 2021Jack DawkinsAfter having suffered from a significant decline the Second Sight Medical Products (NASDAQ: EYES) stock has gone into recovery mode.This could well be the time for investors to start tracking the stock once again. The company is involved in providing solutions to people who might be suffering from different kinds of visual impairments. That being said it seems that investors are still not yet convinced about the long-term prospects of the company. The stock has had a bit of a rollercoaster ride over the course of the past year.Related:\xc2\xa0 Acasti Pharma (ACST) has Hit a Bottom Bounces Back In SightAt some points the bulls have held sway while bears won the day at others. It was towards the end of 2020 that the stock really started showing signs of going on a strong rally after the bulls pushed it to $1.87 a share. Last month the stock enjoyed a remarkable rally and eventually hit its highest levels in 52 weeks of $20 a share. However the stock slumped to lower levels following a selloff. Investors could consider keeping the stock in their watch lists for now.Jack DawkinsFinance and Tech ContributorRelated:\xc2\xa0 Weekly Growing Stock To Consider: Cellectar Biosciences (NASDAQ: CLRB)\xe2\x86\x90 Is GeoVax Labs (GOVX) Stock Ready to Bounce Back in 2021?Provention Bio (PRVB) Stock Shows Wild Moves: What\xe2\x80\x99s Going On? \xe2\x86\x92Jack DawkinsFinance and Tech ContributorCopyright \xc2\xa9 2021 Own Snap. All rights reserved.Theme: ColorMag by ThemeGrill. Powered by WordPress.xx', b'https://ownsnap.com/second-sight-medical-products-eyes-stock-shows-early-sign-of-rebound/' 
b'Should You Accumulate Second Sight Medical Products Inc (EYES) Stock Friday?', b'4 days ago', b"InvestorsObserver's proprietary ranking system gives EYES stock a score of 0 out of a possible 100. That rank is chiefly influenced by a short-term technical score...Should You Accumulate Second Sight Medical Products Inc (EYES) Stock Friday?News HomeShould You Accumulate Second Sight Medical Products Inc (EYES) Stock Friday?Friday April 09 2021 01:42 PM | InvestorsObserver AnalystsSecond Sight Medical Products Inc (EYES) stock has risen 816.98% over the last 12 months. InvestorsObserver\xe2\x80\x99s proprietary ranking system gives EYES stock a score of0 out of a possible 100.That rank is chiefly influenced by a short-term technical score of 0. EYES's rank also includes a long-term technical score of 0. The fundamental score for EYES is 0. .EYES has an Overall Score of 0. Find out what this means to you and get the rest of the rankings on EYES!See Full EYES ReportWhat's Happening with EYES Stock TodaySecond Sight Medical Products Inc (EYES) stock has gained 15.99% while the S&P 500 has risen 0.27% as of 1:39 PM on Friday Apr 9. EYES has risen $1.34 from the previous closing price of $8.38 on volume of 8707091 shares. Over the past year the S&P 500 is up 47.26% while EYES has risen 816.98%. EYES lost -$0.72 per share in the over the last 12 months.Click Here to get the full Stock Score Report on Second Sight Medical Products Inc (EYES) Stock.Share this article:Related ArticlesEuropean ADRs Move Higher in Wednesday TradingWednesday April 14 2021 11:07 AM | MT NewswiresGalectin Therapeutics (GALT) Stock Surges After Phase 1 ResultsWednesday April 14 2021 11:00 AM | Kyle DepontesIs Protalix Biotherapeutics Inc (PLX) a Stock to Watch After Gaining 14.79% This Week?Wednesday April 14 2021 11:00 AM | InvestorsObserver AnalystsIs Arcus Biosciences Inc (RCUS) a Stock to Watch After Gaining 10.27% This Week?Wednesday April 14 2021 11:00 AM | InvestorsObserver AnalystsShould You Buy Moderna Inc (MRNA) Stock After it Is Up 18.73% in a Week?Wednesday April 14 2021 11:00 AM | InvestorsObserver AnalystsShould You Buy Amarin Corporation plc (AMRN) Stock After it Is Lower By 12.23% in a Week?Wednesday April 14 2021 11:00 AM | InvestorsObserver AnalystsRelated CompaniesEYESYou May Also LikeRelated ArticlesEuropean ADRs Move Higher in Wednesday TradingWednesday April 14 2021 11:07 AM | MT NewswiresGalectin Therapeutics (GALT) Stock Surges After Phase 1 ResultsWednesday April 14 2021 11:00 AM | Kyle DepontesIs Protalix Biotherapeutics Inc (PLX) a Stock to Watch After Gaining 14.79% This Week?Wednesday April 14 2021 11:00 AM | InvestorsObserver AnalystsIs Arcus Biosciences Inc (RCUS) a Stock to Watch After Gaining 10.27% This Week?Wednesday April 14 2021 11:00 AM | InvestorsObserver AnalystsShould You Buy Moderna Inc (MRNA) Stock After it Is Up 18.73% in a Week?Wednesday April 14 2021 11:00 AM | InvestorsObserver AnalystsShould You Buy Amarin Corporation plc (AMRN) Stock After it Is Lower By 12.23% in a Week?Wednesday April 14 2021 11:00 AM | InvestorsObserver AnalystsRelated CompaniesEYESContact413-A East Main StreetCharlottesville VA 22902US: +1 800 698 9101International: +1 434 293 9100StocksStocks DashboardTop 5 StocksStock ScreenerOptionsOptions DashboardOptions PortfoliosOptions Trade ScreenerAccount and SupportMy AccountAbout UsNewslettersContact UsHelp CenterReviewsEmail Whitelist InstructionsStock Price data may be delayed up to 15 minutes.Copyright \xc2\xa9 2021. Portions of this content may be copyrighted by Fresh Brewed Media Investors Observer and/or O2 Media LLC. All Rights Reserved. Portions of this content protected by US Patent numbers 7865496 7856390 and 7716116. Investing in stocks bonds option and other financial instruments involve risks and may not be suitable for everyone. Portfolio results are unaudited and based on varying investment expiration dates. Terms of Service | Privacy Policy", b'https://www.investorsobserver.com/news/stock-update/should-you-accumulate-second-sight-medical-products-inc-eyes-stock-friday' 
b'Where Does Second Sight Medical Products Inc (EYES) Stock Fall in the Medical Devices Field After It Is Up 6.65% This Week?', b'6 days ago', b"Where Does Second Sight Medical Products Inc (EYES) Stock Fall in the Medical Devices Field After It Is Up 6.65% This Week? Wednesday April 07 2021 02:45...Where Does Second Sight Medical Products Inc (EYES) Stock Fall in the Medical Devices Field After It Is Up 6.65% This Week?News HomeWhere Does Second Sight Medical Products Inc (EYES) Stock Fall in the Medical Devices Field After It Is Up 6.65% This Week?Wednesday April 07 2021 02:45 PM | InvestorsObserver AnalystsSecond Sight Medical Products Inc (EYES) is around the bottom of the Medical Devices industry according to InvestorsObserver. EYES received an overall rating of 0 which means that it scores higher than 0 percent of all stocks. Second Sight Medical Products Inc also achieved a score of 0 in the Medical Devices industry putting it above 0 percent of Medical Devices stocks. Medical Devices is ranked 71 out of the 148 industries.EYES has an Overall Score of 0. Find out what this means to you and get the rest of the rankings on EYES!See Full EYES ReportWhat do These Ratings Mean?Trying to find the best stocks can be a daunting task. There are a wide variety of ways to analyze stocks in order to determine which ones are performing the strongest. Investors Observer makes the entire process easier by using percentile rankings that allows you to easily find the stocks who have the strongest evaluations by analysts.These scores are not only easy to understand but it is easy to compare stocks to each other. You can find the best stock in an industry or look for the sector that has the highest average score. The overall score is a combination of technical and fundamental factors that serves as a good starting point when analyzing a stock. Traders and investors with different goals may have different goals and will want to consider other factors than just the headline number before making any investment decisions.What's Happening With Second Sight Medical Products Inc Stock Today?Second Sight Medical Products Inc (EYES) stock is lower by -11.56% while the S&P 500 is up 0.15% as of 2:43 PM on Wednesday Apr 7. EYES is down -$1.09 from the previous closing price of $9.43 on volume of 3839655 shares. Over the past year the S&P 500 is up 53.42% while EYES is up 917.07%. EYES lost -$0.72 per share the over the last 12 months.Click Here to get the full Stock Score Report on Second Sight Medical Products Inc (EYES) Stock.Share this article:Related ArticlesEuropean ADRs Move Higher in Wednesday TradingWednesday April 14 2021 11:07 AM | MT NewswiresGalectin Therapeutics (GALT) Stock Surges After Phase 1 ResultsWednesday April 14 2021 11:00 AM | Kyle DepontesIs Protalix Biotherapeutics Inc (PLX) a Stock to Watch After Gaining 14.79% This Week?Wednesday April 14 2021 11:00 AM | InvestorsObserver AnalystsIs Arcus Biosciences Inc (RCUS) a Stock to Watch After Gaining 10.27% This Week?Wednesday April 14 2021 11:00 AM | InvestorsObserver AnalystsShould You Buy Moderna Inc (MRNA) Stock After it Is Up 18.73% in a Week?Wednesday April 14 2021 11:00 AM | InvestorsObserver AnalystsShould You Buy Amarin Corporation plc (AMRN) Stock After it Is Lower By 12.23% in a Week?Wednesday April 14 2021 11:00 AM | InvestorsObserver AnalystsRelated CompaniesEYESYou May Also LikeRelated ArticlesEuropean ADRs Move Higher in Wednesday TradingWednesday April 14 2021 11:07 AM | MT NewswiresGalectin Therapeutics (GALT) Stock Surges After Phase 1 ResultsWednesday April 14 2021 11:00 AM | Kyle DepontesIs Protalix Biotherapeutics Inc (PLX) a Stock to Watch After Gaining 14.79% This Week?Wednesday April 14 2021 11:00 AM | InvestorsObserver AnalystsIs Arcus Biosciences Inc (RCUS) a Stock to Watch After Gaining 10.27% This Week?Wednesday April 14 2021 11:00 AM | InvestorsObserver AnalystsShould You Buy Moderna Inc (MRNA) Stock After it Is Up 18.73% in a Week?Wednesday April 14 2021 11:00 AM | InvestorsObserver AnalystsShould You Buy Amarin Corporation plc (AMRN) Stock After it Is Lower By 12.23% in a Week?Wednesday April 14 2021 11:00 AM | InvestorsObserver AnalystsRelated CompaniesEYESContact413-A East Main StreetCharlottesville VA 22902US: +1 800 698 9101International: +1 434 293 9100StocksStocks DashboardTop 5 StocksStock ScreenerOptionsOptions DashboardOptions PortfoliosOptions Trade ScreenerAccount and SupportMy AccountAbout UsNewslettersContact UsHelp CenterReviewsEmail Whitelist InstructionsStock Price data may be delayed up to 15 minutes.Copyright \xc2\xa9 2021. Portions of this content may be copyrighted by Fresh Brewed Media Investors Observer and/or O2 Media LLC. All Rights Reserved. Portions of this content protected by US Patent numbers 7865496 7856390 and 7716116. Investing in stocks bonds option and other financial instruments involve risks and may not be suitable for everyone. Portfolio results are unaudited and based on varying investment expiration dates. Terms of Service | Privacy Policy", b'https://www.investorsobserver.com/news/stock-update/where-does-second-sight-medical-products-inc-eyes-stock-fall-in-the-medical-devices-field-after-it-is-up-6-65-this-week' 
b"Cyber-firm Darktrace eyes '\xc2\xa33bn' London share listing", b'2 days ago', b'Cyber-security firm Darktrace has said it intends to list its shares on the London Stock Exchange. Darktrace did not indicate how much it is seeking to raise but...Cyber-firm Darktrace eyes \'\xc2\xa33bn\' London share listing - BBC Newsimage copyrightGetty Imagesimage captionDarktrace\'s Poppy Gustafsson says her company is very different from DeliverooCyber-security firm Darktrace has said it intends to list its shares on the London Stock Exchange.Darktrace did not indicate how much it is seeking to raise but media reports suggest it could be as much as \xc2\xa33bn.The move is seen as a sign of confidence in the London market after Deliveroo\'s flop flotation last month.The food delivery business saw its shares fall sharply when trading began casting doubt on efforts to persuade more big tech firms to list in the UK.Darktrace was set up in 2013 by former members of the UK security services and maths professors.It was among the first companies in its field to use artificial intelligence (AI) or machine learning to improve cyber-security.Rather than simply looking for a virus its systems constantly monitor a company\'s computer system to look for abnormal patterns or behaviours.Deliveroo shares tumble on stock market debutDarktrace chief executive Poppy Gustafsson said a London listing was a "logical choice" for the Cambridge-based firm and that a US listing had not been considered.She said Darktrace was a "very different company" from Deliveroo being "a fundamental technology company".Darktrace\'s annual revenue has grown from $79.4m (\xc2\xa357.7m) to $199.1m in the past two years.However it did not turn a profit on a pre-tax or operating basis.Its largest shareholder is Invoke Trust an investment fund belonging to tech entrepreneur Mike Lynch who is facing fraud charges in the US related to the sale of his firm Autonomy in 2011 to computer giant Hewlett-Packard.Ms Gustafsson said Mr Lynch had no involvement in the day-to-day running of Darktrace and his legal proceedings would have no impact on its performance."There is a lot riding on Darktrace\'s forthcoming IPO after Deliveroo\'s stock market flop" said Russ Mould investment director at AJ Bell adding that the food delivery firm\'s "disaster" had "put a cloud over the UK tech sector and whether other tech entrepreneurs would really want to risk floating their company in London"."If Darktrace manages to float its shares successfully and see them rise in value once trading begins then sentiment may improve towards London as a listing venue" Mr Mould said.Related TopicsCyber-securityArtificial intelligenceCompaniesMore on this story\'It\'s a hacker\'s paradise out there\'Published30 April 2018Deliveroo shares tumble on stock market debutPublished31 MarchTop StoriesTories reject Labour plan for MP-led lobbying probeBoris Johnson says a government-commissioned review by a lawyer should examine the issue instead.Published5 minutes agoDUP leader Foster sues TV doctor for defamationPublished2 hours agoOffice manager begged terrorist not to stab herPublished4 minutes agoFeatures\'I\'m being used as a sex-baiting bot online\'Volcano blankets island in layer of grey. VideoVolcano blankets island in layer of greyMeet the writers who told pop stars: \'Stop stealing\'Sir Mick Jagger: \'Why I stopped writing my memoir\'Afghans face pivotal moment as US \'closes the book\'Who can I vote for in my area?Why these students enjoyed lockdown learning. VideoWhy these students enjoyed lockdown learning\'He was using my gayness and throwing it at me\'Seven things you might not know about Brick LaneElsewhere on the BBCKatherine Ryan is on the hunt...Eight talented jewellers bring the bling and aim for a glittering careerSix things we didn\'t know about The BeatlesFrom the theft of Ringo\xe2\x80\x99s hair to auctions of Beatles\xe2\x80\x99 body parts...Most ReadDUP leader Foster sues TV doctor for defamation1Disgraced financier Bernie Madoff dies in prison2Airport queues becoming \'untenable\' says Heathrow3Office manager begged terrorist not to stab her4Grandad bags lottery prize after glasses mishap5Gang jailed for \xc2\xa3160k supermarket thefts6Suez Canal ship held over $900m compensation claim7Young woman \'pleading\' for hysterectomy8Rehearsals take place for Prince Philip\'s funeral9Covid test firm cuts price amid criticism over cost10BBC News ServicesOn your mobileOn smart speakersGet news alertsContact BBC NewsI Can See Your VoiceThe brand-new mystery singing gameshow! iPlayerThe brand-new mystery singing gameshow!AttributionBBC iPlayerCan Jimmy suss the good from the bad? VideoCan Jimmy suss the good from the bad?AttributionBBC OneWhat you see isn\'t always what you get.. VideoWhat you see isn\'t always what you get..AttributionBBC OneCan everyone sing really?AttributionBBC BitesizeHomeNewsSportWeatheriPlayerSoundsCBBCCBeebiesFoodBitesizeArtsTasterLocalThreeTerms of UseAbout the BBCPrivacy PolicyCookiesAccessibility HelpParental GuidanceContact the BBCGet Personalised NewslettersWhy you can trust the BBC\xc2\xa9 2021 BBC. The BBC is not responsible for the content of external sites. Read about our approach to external linking.', b'https://www.bbc.co.uk/news/business-56720039' 
b'IBD 50 Stocks To Watch: Fertility Stock Progyny Delivers This Bullish ...', b'20 hours ago', b'Progyny stock delivered a bullish move as it eyes a new buy point. Progyny is a fertility benefits manager. When an employer chooses to use Progyny the fertility...', b'https://www.investors.com/research/progyny-stock-delivers-this-bullish-move-eyes-buy-point/' 
b'Ford Partners With Nio On Charging As Chinese Auto Giant Geely ...', b'19 hours ago', b'Ford Partners With Nio On Charging As Chinese Auto Giant Geely Eyes EV Deal', b'https://www.investors.com/news/ford-stock-nio-partnership-chinese-auto-giant-geely-eyes-ev-deal/' 
b'Most Shorted Stocks: Could EYES BLNK DISCA or CLVS Be the Next GameStop?', b'4 days ago', b"Most Shorted Stocks: Could EYES BLNK DISCA or CLVS Be the Next GameStop?Most Shorted Stocks: Could EYES BLNK DISCA or CLVS Be the Next GameStop? | InvestorPlaceSkip to contentClose MenuLog inLog outMy ServicesSupportPremium ServicesOur AnalystsContact UsHelpCareersAdvertise With UsDisclosures & DisclaimersPrivacy PolicyTerms of UseDMCA PolicyCopyright \xc2\xa9 2021 InvestorPlace Media LLC. All rights reserved. 1125 N. Charles St Baltimore MD 21201.Millions of People Will Soon Be Blindsided. Will You Be One of Them?On April 20 at 7 p.m. ET Louis Navellier and Matt McCall will reveal an event that\xe2\x80\x99s about to rock the stock market and how you could use it to beat the markets by nearly 11X.Tue April 20 at 7:00PM ETDaysHoursMinutesSecondsRegister Here FreeHome / Today's Market / Most Shorted Stocks: Could EYES BLNK DISCA or CLVS Be the Next GameStop?A couple days ago hedge fund manager Will Meade came up with an interesting idea. He hopped on Twitter to discuss why he thinks ChargePoint (NYSE:CHPT) could be the next GameStop (NYSE:GME). The tweets have many investors sitting up in their seats. As one of the most shorted stocks Meade\xe2\x80\x99s case does hold water. And with retail investors chasing the success of GME through stocks like AMC (NYSE:AMC) there\xe2\x80\x99s lots of chatter around which stock could have the same squeeze potential as the video game retailer.Source: TY Lim / Shutterstock.comWe can take a look at the most shorted stocks right now to see some potential short-squeeze candidates. One of these stocks is Second Sight Medical Products (NASDAQ:EYES). The eye health technology company has been called overvalued before after a regulatory approval sent EYES stock sky high. Now the company is short interest of 49.4%. While short-sellers predict EYES to drop off in value Second Sight has some real fans. And with news that the company has made two promising new additions to its board of directors sentiment could turn bullish.Another short squeeze candidate is\xc2\xa0Blink Charging (NASDAQ:BLNK). With a 36.9% short interest many are predicting the company\xe2\x80\x99s failure. However it has a dedicated backing of retail fans including some r/WallStreetBets users. The company has actually seen some short squeeze activity in the last two days already providing 13% gains on Thursday.Most Shorted Stocks: Investors Search for Squeeze CandidatesDiscovery (NASDAQ:DISCA) is in a volatile state. The company was among those caught up in the Archegos Capital Management fallout. Now it seems investors are looking at DISCA stock for a short squeeze. It currently has 29.67% of its float sold short and as a player in the huge streaming industry there is consumer interest in what it offers.Finally\xc2\xa0Clovis Oncology (NASDAQ:CLVS) is a candidate for a GME-esque short squeeze. The oncology outfit has made promising news recently regarding its Rubraca trials. The company is hoping to get a product to market soon to help treat late-stage ovarian cancer patients and its clinical trials are suggesting the launch could be soon. Still CLVS stock is being bet against with 33.85% of its float shorted. With the positive news about the Rubraca tests as well as speculation of an acquisition in 2021 the stock seems like a prime candidate for a short squeeze.On the date of publication Brenden Rearick did not have (either directly or indirectly) any positions in the securities mentioned in this article.Article printed from InvestorPlace Media https://investorplace.com/2021/04/most-shorted-stocks-could-eyes-blnk-disca-or-clvs-be-the-next-gamestop/.\xc2\xa92021 InvestorPlace Media LLCSponsored HeadlinesMore from InvestorPlaceStocks to BuyBelow $20 Opendoor Stock Is an Absolute Steal With 10X PotentialBy Luke LangoApr 12 2021Stocks to BuyCanaan Is a Bitcoin Mining Investment the Market Hasn\xe2\x80\x99t Caught On To YetBy Louis Navellier and the InvestorPlace Research StaffApr 13 2021Today's MarketWhat Will the Stock Market Do Today? 3 Big Stories to Watch.By Sarah SmithApr 14 2021ADVERTISEMENTMost PopularToday's MarketDogecoin Price Predictions: Where Will DOGE Go After Musk\xe2\x80\x99s Latest Moonshot?Today's MarketNIO Stock: What Is the Huge Nio Catalyst Coming on April 15?Today's MarketDogecoin Price Predictions: Where Does Red-Hot DOGE Go After Record High?Today's MarketCoinbase IPO: Can COIN Stock Really Hit $600 After Its April 14 IPO?Hot StocksCruising May Resume Too Late to Save Carnival StockADVERTISEMENTContact UsHelpCareersAdvertise With UsDisclosures & DisclaimersPrivacy PolicyTerms of UseDMCA PolicyFinancial Market Data powered by FinancialContent Services Inc. All rights reserved. Nasdaqquotes delayed at least 15 minutes all others at least 20 minutes.Copyright \xc2\xa92021 InvestorPlace Media LLC. All rights reserved. 1125 N. Charles St Baltimore MD 21201.Subscriber Sign inUsernamePasswordSign inHaving trouble logging in?Not Yet a Premium Subscriber?SubscribeClose login modal", b'https://investorplace.com/2021/04/most-shorted-stocks-could-eyes-blnk-disca-or-clvs-be-the-next-gamestop/' 
