title, time, description, link 
b'WWE Stock Report: They forgot about Peyton Royce and Nikki Cross', b'3 days ago', b'Stock Down #3: Elias & Jaxson Ryker. WWE wants us to believe that 51 year old Shane McMahon is a better professional wrestler than both Elias and Jaxson...WWE Stock Report: They forgot about Peyton Royce and Nikki Cross - Cageside SeatsSkip to main contentCookie bannerWe use cookies and other tracking technologies to improve your browsing experience on our site show personalized content and targeted ads analyze site traffic and understand where our audiences come from. To learn more or opt-out read our Cookie Policy. Please also read our Privacy Notice and Terms of Use which became effective December 20 2019.By choosing I Accept you consent to our use of cookies and other tracking technologies.I Acceptclockmenumore-arrownoyesRumor RoundupWWESectionsWWE RawWWE SmackDownWWE NXTAEWImpactNew JapanDraftKings NationFanPostsMastheadCommunity Guidelines\xe2\x9c\x95Filed under:WWEWWE RawWWE SmackDownWWE Stock Report: They forgot about Peyton Royce and Nikki CrossNew7commentsByCain A. KnightApr 10 20214:00pm EDTIf you buy something from an SB Nation link Vox Media may earn a commission. See our ethics statement.Share this storyShare this on FacebookShare this on TwitterShareAll sharing optionsShareAll sharing options for:WWE Stock Report: They forgot about Peyton Royce and Nikki CrossRedditPocketFlipboardEmailWWE.comSome places do power rankings. Here at Cageside we do a stock report.In this weekly series we identify three Superstars (or groups of Superstars) who are on their way up and three that are moving in the opposite direction. After a busy week that included the Andre the Giant Memorial Battle Royal Tamina going one-on-one with Nia Jax and Baron Corbin wrestling in the main event of Raw a lot of fortunes were changed.With that in mind let\xe2\x80\x99s see whose stock has increased the most this week:Stock Up #3: Rhea RipleyRhea Ripley turned on Asuka during a tag team match on this week\xe2\x80\x99s (Apr. 5) Raw making things more personal between the two superstars and cementing Rhea\xe2\x80\x99s spot as the heel in their upcoming match at WrestleMania 37.Stock Up #2: Dolph Ziggler & Robert RoodeI was genuinely surprised to see the Top Dirty Dawgs win this week\xe2\x80\x99s (Apr. 9) fatal 4-way match for the SmackDown tag titles over the Street Profits the Mysterios and Alpha Academy. Roode & Ziggler have essentially wiped out the competition for their tag titles multiple times over the last three months.Stock Up #1: Bad Bunny Damian Priest The Miz John MorrisonThe story between these four men received a huge focus on Raw; things escalated quite a bit from the previous weeks of trading guitar shots.It started when Miz & Morrison gave Bunny\xe2\x80\x99s multi-million dollar car a custom paint job and then ambushed him afterwards. This led toa very long but mostly effective promo from Bunny asserting that the Miz is going to get his ass kicked at WrestleMania. To cap it off Priest and Morrison were officially added to the match. That\xe2\x80\x99s a good thing because they are both much better workers than their respective tag partners.Don\xe2\x80\x99t miss WrestleMania 37 on Peacock!WWE Network has moved and Peacock will be your source for every live WWE pay-per-view event\xe2\x80\x94including WrestleMania.Sign up here!Now let\xe2\x80\x99s see whose stock has decreased the most this week:Stock Down #3: Elias & Jaxson RykerWWE wants us to believe that 51 year old Shane McMahon is a better professional wrestler than both Elias and Jaxson Ryker.Elias & Ryker continually get fed to Braun Strowman (this week in a handicap match) while Shane is the athlete who Braun struggles to take down. These two guys come off as total jabronis while playing the role of Shane\xe2\x80\x99s hapless lackeys.Stock Down #2: Nikki Cross Peyton Royce RECKONINGThere\xe2\x80\x99s been a lot of consternation over Bayley\xe2\x80\x99s glaring absence from WrestleMania 37. But these three women are also missing from the card and it\xe2\x80\x99s worth talking about.WWE tried to get most of the women\xe2\x80\x99s division on the WrestleMania card by booking a Tag Team Turmoil match. Five teams will compete in that match including the completely made-up team of Billie Kay and Carmella. I understand if RECKONING can\xe2\x80\x99t be paired with anybody due to her terrible RETRIBUTION gimmick but what about Peyton Royce and Nikki Cross? Surely there\xe2\x80\x99s room for one additional makeshift team in the turmoil match no?According to CageMatch Mia Yim has not wrestled a match in 2021. Royce was left out in the cold despite her obvious history with Billie Kay reinforcing that the breakup of The IIconics was a pointless decision. And Nikki Cross is lamenting on Twitter about how she just wants to wrestle and it\xe2\x80\x99s what she was born to do. Unfortunately it looks like she won\xe2\x80\x99t get to do it at WrestleMania 37.Stock Down #1: Cedric Alexander & Shelton BenjaminI don\xe2\x80\x99t know who these guys pissed off but they continue to get beaten into the ground. Lashley beat the hell out of both of them on Raw and then they were bounced very early on during the Andre the Giant Memorial Battle Royal on SmackDown. This is the fourth consecutive week that Benjamin and Alexander have appeared on the Stock Down side of this column and the third straight week where they\xe2\x80\x99ve landed in the very worst spot.There you have it Cagesiders. Whose stock do you think has changed the most this week?Next Up InWWERumor Roundup: Change to Fiend/Orton plans U.S. title switch WrestleMania producers more!Raw recap & reactions: Just getting startedAlexa Bliss explains turning on The Fiend at WrestleMania 37Charlotte Flair returns cuts the best promo of her careerWrestleMania Backlash gets its WWE championship matchWrestleMania 37 had some of best & worst matches in the event\xe2\x80\x99s historyMost ReadRumor Roundup: WrestleMania 37 changes Roman Reigns Daniel Bryan more!The latest rumors including how talk of more matches from WrestleMania that were changed late a big match that wasn\xe2\x80\x99t touched and more!NXT recap & reactions: The landscape has changed!Raquel Gonz\xc3\xa1lez is your new women\xe2\x80\x99s champion Karrion Kross is the new men\xe2\x80\x99s champion MSK are the new tag team champs and so much more! Break down the entire Apr. 13 2021 WWE NXT episode with us - right here.Roderick Strong quits NXTThe Undisputed Era is done and it looks like Strong is too.Rumor Roundup: Change to Fiend/Orton plans U.S. title switch more!The latest rumors including when it was decided Randy would beat Wyatt on Sunday why Sheamus is a champ again who agented which matches last weekend and more!Rhea Ripley Bianca Belair make surprise appearance on NXT TVLook who showed up to celebrate the future on NXT this week.Loading comments...ChorusFanPostsFanShotsMastheadCommunity GuidelinesFacebookTwitterYouTubeHorizontal - WhiteContactHave a News Tip?Browse BlogsAbout SBNCompany BlogBlog OpeningsEditorial Ethics and GuidelinesVox MediaVox MediaVox Media logo.Terms of UsePrivacy NoticeCookie PolicyDo Not Sell My Personal InfoLicensing FAQAccessibilityPlatform StatusAdjust cookie preferencesAdvertise with usJobs @ Vox Media\xc2\xa9 2021 Vox Media LLC. All Rights ReservedSports data \xc2\xa9 STATS 2018 | SB Nation CombatShare this storyTwitterFacebook', b'https://www.cagesideseats.com/wwe/2021/4/10/22377305/wwe-stock-report-apr-2021-bad-bunny-miz-priest-nikki-cross-royce-mia-yim-ripley-roode-ziggler-elias' 
b"As WrestleMania Returns Is Now The Time To Buy WWE's Stock?", b'4 days ago', b'World Wrestling Entertainment Inc. (NYSE: WWE) fans and investors are gearing up ... WWE investors had a rough 2020 and the stock is still down 11.8% from...', b'https://www.benzinga.com/analyst-ratings/analyst-color/21/04/20558715/as-wrestlemania-returns-is-now-the-time-to-buy-wwes-stock%3Futm_source%3Dfeedburner%26utm_medium%3Dfeed%26utm_campaign%3DFeed%253A%2Bbenzinga%2B%2528Benzinga%2BNews%2BFeed%2529' 
b'WWE Executive Salaries Revealed For The McMahon Family And Others', b'10 hours ago', b'WWE Chairman & CEO Vince McMahon \xe2\x80\x93 $1.4 million in 2021 (equal with 2020 ... These base salaries do not include stock options and bonuses or any talent...WWE Executive Salaries Revealed For The McMahon Family And Others - Wrestling Inc.WWE Executive Salaries Revealed For The McMahon Family And OthersByMarc Middleton |April 13 2021(Photo Credit: WWE)WWE released their latest Proxy Statement for shareholders today announcing that the 2021 Annual Meeting of Stockholders will be held on Thursday May 27 at 11am ET. This year the meeting again will be a virtual meeting due to the pandemic.The SEC filing also includes salaries for top executives in the company including the McMahon Family.The following base salaries were included in the filing with their 2019 and 2020 comparisons. We have also included the 2018 filings.* WWE Chairman & CEO Vince McMahon \xe2\x80\x93 $1.4 million in 2021 (equal with 2020 2019 2018)* WWE President & Chief Revenue Officer Nick Khan \xe2\x80\x93 $1.2 million in 2021 (1.2 million in 2020 Khan joined the company in August 2020)* WWE Executive Vice President of Global Talent Strategy & Development Paul \xe2\x80\x9cTriple H\xe2\x80\x9d Levesque \xe2\x80\x93 $730000 in 2021 ($730000 in 2020 $710000 in 2019 $684125 in 2018 $650000 in 2017)* WWE Chief Brand Officer Stephanie McMahon \xe2\x80\x93 $730000 in 2021 ($730000 in 2020 $710000 in 2019 $684125 in 2018)* WWE Chief Financial Officer Kristina Salen \xe2\x80\x93 $730000 in 2021 ($730000 in 2020 Salen joined the company in July 2020 becoming CFO in August 2020)These base salaries do not include stock options and bonuses or any talent pay for Triple H and Stephanie.Stay tuned for more.PreviousReginald On Why He Missed WrestleMania 37NextNew WWE NXT Match Announced For TonightPlease enable JavaScript to view thecomments powered by Disqus.Follow @WrestlingINCRecentSteve Austin On Why A Comeback Match Would Be \xe2\x80\x9cAnti-Climatic\xe2\x80\x9dChris Jericho Talks AEW Driving WWE NXT \xe2\x80\x9cScreaming And Yelling Away From Wednesdays\xe2\x80\x9dPaul Heyman Has Sexual Analogy About Wrestling Without CrowdsMLW Fusion Preview (4/14): Three Big Title Defenses Scheduled Hammerstone Vs. MuertesSeth Rollins\xe2\x80\x99 Wrestling School Thanks Vince McMahon For WWE Ring UpgradeAEW Dynamite Preview: Two Title Matches Mike Tyson Kris StatlanderJacob Fatu Comments On His Decision To Sign Long-Term MLW DealRhea Ripley On Which Former WWE Star Was A Big Influence How She Met Her Boyfriend\xc2\xbb WrestleMania 37 (Night 1) Results\xc2\xbb WrestleMania 37 (Night 2) ResultsTrendingWrestling Veteran On Why He Had To Turn Off The WrestleMania 37 Night Two Main EventBackstage Note On When Randy Orton Vs. The Fiend Was Changed Other Finishes ChangedCharlotte Flair Responds To Fan Criticism Over How She Looked On RAWFormer WWE Superstar Now Owns His Ring NameWWE Monday Night RAW Results \xe2\x80\x93 WrestleMania 37 Fallout The Viking Raiders Return MorePhotos: Former WWE Superstar Gets MarriedWWE NXT Results \xe2\x80\x93 Takeover Fallout Eight-Person Main Event New Champion MoreEmail UpdatesSend NewsJob OpeningsContact UsPrivacy Policy\xc2\xa9 2021 Webcapacity Incorporated. All Rights ReservedBack To Top', b'https://www.wrestlinginc.com/news/2021/04/wwe-executive-salaries-revealed-for-the-mcmahon-family-and-others/' 
b'WWE is fully converted to Peacock now it wants to make more content', b'6 days ago', b'The WWE will host its WrestleMania 37 event exclusively on Peacock as part of a ... getting from Wall Street: Why should investors be interested in WWE stock?WWE is fully converted to Peacock now it wants to make more contentSkip NavigationMarketsPre-MarketsU.S. MarketsEurope MarketsChina MarketsAsia MarketsWorld MarketsCurrenciesCryptocurrencyFutures & CommoditiesBondsFunds & ETFsBusinessEconomyFinanceHealth & ScienceMediaReal EstateEnergyEnvironmentTransportationIndustrialsRetailWealthLifeSmall BusinessInvestingInvest In YouPersonal FinanceFintechFinancial AdvisorsTrading NationOptions ActionETF StreetBuffett ArchiveEarningsTrader TalkTechCybersecurityEnterpriseInternetMediaMobileSocial MediaVenture CapitalTech GuidePoliticsWhite HousePolicyDefenseCongressFinding SolutionsEurope PoliticsChina PoliticsAsia PoliticsWorld PoliticsCNBC TVLive AudioLatest VideoTop VideoCEO InterviewsEurope TVAsia TVCNBC PodcastsDigital OriginalsWatchlistPROPro NewsPro LiveSubscribeSign InMenuKey PointsThe WWE will host its WrestleMania 37 event exclusively on Peacock as part of a $1 billion rights agreement.The entertainment company decided to leave the streaming business and return to fully developing content.In this articleWWEPerhaps executives at World Wrestling Entertainment said it best \xe2\x80\x93 WWE is not a technology company. Instead of operating as a streaming service it now wants to return to making content.WWE will host the Super Bowl of wrestling this weekend with its WrestleMania event on NBCUniversal\'s Peacock streaming service. It\'s part of a more than $1 billion exclusive rights deal that is repositioning the longtime entertainment company to focus on its product and avoid the streaming wars."At the end of the day we\'re not a technology company and shouldn\'t try to be" WWE chief brand officer Stephanie McMahon told CNBC. "We are a content company at our core and we want to do what we do best."Added chief financial officer Kristina Salen: "Everyone has a plus. There is Disney+ Paramount+ Discovery+ but not everyone has branded content with a huge fan base like WWE. So we saw there was a huge demand for what we had to offer and we could take that money and double down and do what we do best which is content."The focus on creating content shows a sort of counter-narrative to the streaming wars where companies create apps and services loaded with movies and TV shows. WWE is ditching its own streaming service and is instead focusing on making new stuff for people to watch on Peacock.The content game is only the beginning for WWE in this new decade as it prepares for a post-Covid world with new revenue possibilities. But the future will also bring questions about whether WWE is a smart investment and how it plans to approach more competition that wants to threaten its market share.WWE Chief Brand Officer Stephanie McMahon of US speaks during the Web Summit 2018 in Lisbon Portugal on November 6 2018.Pedro Fi\xc3\xbaza | NurPhoto | Getty ImagesLessons learnedLike the rest of the entertainment world WWE had to innovate on the fly after the pandemic hit last spring. The company moved events to Florida to continue operations and save media rights. It adjusted to no spectators by transitioning its pyrotechnics-filled content to a more cinematic production around wrestling matches."It\'s like a movie" McMahon said after describing longtime character The Undertaker\'s cemetery-style match last year. "And in addition to that the real innovation came with investing in the Thunderdome" \xe2\x80\x93 an indoor complex built in Florida to host events."We experimented with drone cameras pyros augmented reality that we couldn\'t have done before mostly because of live bodies in the actual stands" McMahon added. "It\'s going to be a lot of testing and learning what makes sense to bring forward and trying different things."WWE\'s real transition started before Covid-19 when chairman and CEO Vince McMahon fired two critical executives in January 2020. Talk around this change centered on seeing the future differently.In 2014 former WWE co-president George Barrios saw value in the company\'s new streaming service. It cost $10 a month and helped the company transition away from traditional pay per view. But WWE failed to grow subscribers reaching about 1 million in the U.S. In addition the company exited another failed pro football start-up with the XFL.WWE Network dismantled its U.S. operations to start 2021 and signed with Peacock. The move provides live WWE events and a classic wrestling library to Peacock subscribers."It\'s a big win for WWE" said media rights expert Dan Cohen. "The price point comes down so you hope that subscribers and eyeballs go up. They got out of the technology space and don\'t have to keep maintaining and updating tech which changes every minute."Salen Etsy\'s former CFO was one of two new executives hired in 2020. She helped Etsy go public in 2015 and is now partly responsible for WWE\'s financial future including more merchandising e-commerce and corporate sponsorships which will feature new campaigns with longtime partner Procter & Gamble.In its 2020 fourth-quarter report WWE said it suffered an $84 million hit and made $238.2 million in revenue. But though WWE hosted most events with no fans in attendance last year it still made $970 million thanks to Fox Corp. and NBCUniversal\'s rights fees.WWE currently has a market capitalization of roughly $4 billion and is trading at approximately $55 per share. Salen said the WWE Network didn\'t lose money but again its C-Suite consensus was focused on growing licensing fees around its content and to stop operating like Netflix."Just like we were first in pay per view first in direct to consumer and now we\'re the first to go back into aggregators" Salen said. "We felt it was the right moment. And over the course of the next few years we\'re pretty confident that we\'ll be proven right."Salen said an inquiry she\'s often getting from Wall Street: Why should investors be interested in WWE stock?"Investors know that I choose to spend my time at places where ultimately think there is value to be created" she responded. "I think there is this tremendous opportunity over the next few years to create more value for shareholders."WrestleMania 35Source: WWENo concern for the competition\xc2\xa0WrestleMania 37 is scheduled this weekend at Raymond James Stadium the site of the National Football League\'s Super Bowl LV in February.`It\'s banking on 25000 fans showing up and McMahon said the event will mimic many of the NFL\'s Covid-19 protocols \xe2\x80\x93 seating pods distribution of masks hand sanitizer. "Only the configuration is different because we can have people down on the floor" she added.WWE needs to get back to arenas though and maybe more so than pro leagues. The company makes a significant portion of its revenue around live ticket sales and it travels more often throughout the year."As soon as arenas are open for business we can start spinning this up" Salen said. "But we need there to be a critical mass of arenas that are open for business in order for us to do that. And we just don\'t see that right now."WWE also needs to monitor another company that wants to eat into its market share. WarnerMedia\'s Turner Sports property has reinvested in wrestling with All Elite Wrestling (AEW). The network last hosted a major wrestling company in 2001 when it owned World Championship Wrestling (WCW) which WWE purchased.AEW is run by Tony Khan son of National Football League team owner Shahid Khan and has financial backing. And so far it\'s gaining praise for its production."The theatrics are good" said Cohen. "The quality is good. Where AEW lacks though is in star power."Internet chatter suggests the WWE will spend money to keep AEW from achieving that mission. Asked about this Salen said the rumors are not accurate. She added AEW is more competition for its NXT property. This division is like the NBA\'s G League for wrestlers."We\'ve always had competition it\'s part of the game" Salen said. "Internally we pay much closer attention to a Game 7 of the World Series and if Raw is going up against it."World Wrestling Entertainment Inc. Chairman Vince McMahon (L) and wrestler Triple H appear in the ring during the WWE Monday Night Raw show at the Thomas & Mack Center August 24 2009Ethan Miller | Getty Images Entertainment | Getty ImagesWhat\'s the future of WWE?But though WWE could once again hold off a significant challenger it can\'t stop the future. And among the major questions facing it: How long will Vince McMahon continue as CEO? And who will replace him?His daughter Stephanie suggested it would be a collaboration of "institutional knowledge" making the decisions when her father decides to step aside."No one person has all that experience and expertise and passion in building and growing this company from a smaller regional business to this incredible growth company that it is today" she said.Asked to describe WWE\'s future over the long term McMahon used the company tagline. "It sums up everything about WWE" she said. "That is: then now and forever."Disclosure: Peacock is the streaming service of NBCUniversal parent company of CNBC.VIDEO2:5602:56Major brands distance themselves from Deshaun Watson after sexual misconduct allegationsThe News with Shepard SmithSubscribe to CNBC PROLicensing & ReprintsCNBC CouncilsSupply Chain ValuesCNBC on PeacockAdvertise With UsJoin the CNBC PanelDigital ProductsNews ReleasesClosed CaptioningCorrectionsAbout CNBCInternshipsSite MapAd ChoicesCareersHelpContactNews TipsGot a confidential news tip? We want to hear from you.Get In TouchCNBC NewslettersSign up for free newsletters and get more CNBC delivered to your inboxSign Up NowGet this delivered to your inbox and more info about our products and services.\xc2\xa0Privacy Policy|Do Not Sell My Personal Information|CA Notice|Terms of Service\xc2\xa9 2021 CNBC LLC. All Rights Reserved. A Division of NBCUniversalData is a real-time snapshot *Data is delayed at least 15 minutes. Global Business and Financial News Stock Quotes and Market Data and Analysis.Market Data Terms of Use and DisclaimersData also provided by', b'https://www.cnbc.com/2021/04/08/wwe-is-fully-converted-to-peacock-now-it-wants-to-make-more-content.html' 
